{
  "schema": "fleet-config.v1",
  "exportedAt": "2026-09-13T12:00:00Z",
  "source": {
    "label": "scrubbed-fixture"
  },
  "plugins": [
    {
      "pluginId": "pstack"
    },
    {
      "pluginId": "fleet-config"
    }
  ],
  "rules": [
    {
      "path": "fleet-roles.mdc",
      "content": "---\ndescription: Fixture fleet role map (scrubbed).\nalwaysApply: true\n---\n# fleet role → agent map\nbot-designer: Example Designer\neng-orch: Example Orch\nplanner: Example Planner\n"
    }
  ],
  "skills": [
    {
      "slug": "example-skill",
      "name": "Example skill",
      "description": "Fixture skill for verify tests",
      "body": "---\nname: Example skill\ndescription: Fixture skill for verify tests\n---\n# Example skill\n\nDo the example thing. No secrets.\n"
    },
    {
      "slug": "fleet-config-export",
      "name": "Fleet config export",
      "description": "when user wants to serialize/share/replicate fleet config",
      "body": "---\nname: Fleet config export\ndescription: when user wants to serialize/share/replicate fleet config\n---\n# Fleet config export\n\nRun `python3 scripts/serialize_fleet_config.py`.\n"
    }
  ],
  "fleetDocs": [
    {
      "path": "roles-map.md",
      "content": "# roles-map (fixture)\n\n- bot-designer → Example Designer\n- eng-orch → Example Orch\n- planner → Example Planner\n"
    },
    {
      "path": "openspec-binding.md",
      "content": "# OpenSpec binding (fixture)\n\nConvention pointer only.\n"
    }
  ],
  "agents": [
    {
      "roleKey": "bot-designer",
      "name": "Example Designer",
      "description": "Designs bots and runs fresh-install healthchecks.",
      "routines": [
        {
          "slug": "transcript-healthcheck",
          "name": "Transcript healthcheck",
          "description": "Transcript healthcheck routine recipe",
          "scheduleOrTriggerIntent": "on-demand",
          "prompt": "Run transcript healthcheck for this bot. Report PASS/FAIL."
        }
      ]
    },
    {
      "roleKey": "eng-orch",
      "name": "Example Orch",
      "description": "Engineering orchestration lead.",
      "routines": []
    },
    {
      "roleKey": "planner",
      "name": "Example Planner",
      "description": "Plans OpenSpec proposals.",
      "routines": [
        {
          "slug": "daily-plan",
          "name": "Daily plan",
          "description": "Daily plan routine recipe",
          "scheduleOrTriggerIntent": "0 9 * * 1-5",
          "prompt": "Draft today's plan from open tasks. No secrets."
        }
      ]
    }
  ],
  "rooms": [
    {
      "name": "Eng lead",
      "charter": "Non-project eng coordination. Max 6 members.",
      "memberRoleKeys": [
        "eng-orch",
        "planner",
        "bot-designer"
      ]
    },
    {
      "name": "Fleet meta",
      "charter": "org / wiki / ops; NO eng apply.",
      "memberRoleKeys": [
        "bot-designer"
      ]
    }
  ],
  "bootstrap": {
    "order": [
      "plugins",
      "rules",
      "skills",
      "agents",
      "rooms",
      "healthchecks"
    ],
    "notes": [
      "Public scrub mode: operator name scrubbed; no agent/room UUIDs; no secrets files.",
      "Import: CreateAgent for missing roleKeys (match by name); never delete bots; skip New Bot.",
      "Do not pack box-secrets, host-secrets, cookies, transcripts, or user-memory."
    ]
  }
}
